{
  "causal_chain": [
    "donation changes assets",
    "cached value remains stale"
  ],
  "confidence": 0.8,
  "created_at": "2026-08-12T12:00:00Z",
  "decision": "advance",
  "deterministic_rule_version": "1.0.0",
  "dissent": [
    "Deployment configuration still requires confirmation"
  ],
  "evidence_ids": [
    "evd_01J00000000000000000000001"
  ],
  "falsification_attempts": [
    {
      "evidence_ids": [
        "evd_01J00000000000000000000001"
      ],
      "question": "Can the guard prevent the path?",
      "result": "No guard blocks direct transfer",
      "untried_dimensions": [
        "alternate token behavior"
      ]
    }
  ],
  "gate": "B",
  "hypothesis_id": "hyp_01J00000000000000000000001",
  "independent_from": [
    "hyp_01J00000000000000000000001"
  ],
  "integrity": {
    "algorithm": "sha256",
    "canonicalization": "rfc8785",
    "content_hash": "sha256:2293bb81255a8e4ffebca3924276ba0974518292ea65dfd2125ab0e50f8cbf5b",
    "excluded_fields": [
      "integrity.content_hash"
    ]
  },
  "provenance": [
    {
      "license_or_terms": "private-test-fixture",
      "provenance_id": "prv_01J00000000000000000000001",
      "raw_hash": "sha256:bbbbbbbbbbbbbbbbbbbbbbbbbbbbbbbbbbbbbbbbbbbbbbbbbbbbbbbbbbbbbbbb",
      "retrieved_at": "2026-08-12T12:00:00Z",
      "source_uri": "https://fixtures.ayran.dev/m0",
      "source_version": "fixture-v1",
      "transformation_lineage": []
    }
  ],
  "resulting_hypothesis_status": "defect_pinned",
  "reviewer": {
    "id": "devils-advocate-a",
    "independence_group": "fixture-independent",
    "kind": "gate",
    "version": "1.0.0"
  },
  "run_id": "run_01J00000000000000000000001",
  "schema_version": "1.0.0",
  "target_identity": {
    "commit": "1111111111111111111111111111111111111111",
    "scope_id": "scp_01J00000000000000000000001",
    "source_tree_hash": "sha256:dddddddddddddddddddddddddddddddddddddddddddddddddddddddddddddddd",
    "target_id": "tgt_01J00000000000000000000001"
  },
  "verdict_id": "dav_01J00000000000000000000001"
}
